model,role,model_id_or_source,parameter_count,local_revision_or_snapshot,tool_or_package_version,runtime_python,torch,torch_cuda,nvidia_driver,system_cuda,reference_profile,key_generation_settings,public_notes
Irodori-TTS 500M,comparison model,Aratako/Irodori-TTS-500M-v3,500M,236c1e56591279fc24e3c1bf6609fc06e48dde28,tools/Irodori-TTS commit eaf74d6a19138f743acb5b71a445fd25a57db987,3.10.20,2.10.0+cu128,12.8,596.36,13.2,h4n_ref20s_neutral_091_094,"zero-shot reference audio; num_steps=24; model_precision=bf16; model_device=cuda; codec_device=cuda","No speaker fine-tuning. Used as a fast Japanese baseline."
Irodori-TTS 600M VoiceDesign,comparison model,Aratako/Irodori-TTS-600M-v3-VoiceDesign,600M,e863a3a93e652e09afeff3e84823a206a0a60314,tools/Irodori-TTS commit eaf74d6a19138f743acb5b71a445fd25a57db987,3.10.20,2.10.0+cu128,12.8,596.36,13.2,h4n_ref20s_neutral_091_094,"zero-shot reference audio + VoiceDesign caption; num_steps=24; model_precision=bf16; model_device=cuda; codec_device=cuda","No speaker fine-tuning. Best speed/quality balance in this experiment."
Qwen3-TTS 1.7B,comparison model,Qwen/Qwen3-TTS-12Hz-1.7B-Base,1.7B,fd4b254389122332181a7c3db7f27e918eec64e3,qwen-tts 0.1.1,3.12.11,2.8.0+cu128,12.8,596.36,13.2,h4n_ref20s_neutral_091_094,"voice_clone_prompt; dtype=bfloat16; device=cuda:0; temperature=0.65; top_p=0.75; max_new_tokens=192 or 224 or 256 depending on sample","No speaker fine-tuning. Short normalized chunks were more stable than long paragraphs."
Fish Speech S2 Pro,comparison model,fishaudio/s2-pro,not locally verified,refs/main 1de9996b6be38b745688de084d87a5633f714e4e; snapshot dir not present,tools/fish-speech commit e5e292632cb11e7a27b2b7487f58f612bc101e13,3.12.11,2.8.0+cu128,12.8,596.36,13.2,h4n_ref10s_neutral_091_093,"reference audio tokenized with DAC; text2semantic + decode; device=cuda; max_new_tokens from target manifest","No speaker fine-tuning. Strongest subjective naturalness, but slowest by a large margin on RTX 5060 Ti 16GB."
CosyVoice2,comparison model,FunAudioLLM/CosyVoice2-0.5B,0.5B,refs/main eec1ae6c79877dbd9379285cf8789c9e0879293d; snapshot dir not present,tools/CosyVoice commit 074ca6dc9e80a2f424f1f74b48bdd7d3fea531cc,3.10.20,2.8.0+cu128,12.8,596.36,13.2,h4n_ref20s_neutral_091_094,"inference_cross_lingual; speed=1.0; fp16 flag used in some sweeps; generated with local CosyVoice tool","No speaker fine-tuning. H4n reference improved subjective quality."
VoxCPM2 ultimate,comparison model,openbmb/VoxCPM2,2B,bffb3df5a29440629464e5e839f4d214c8714c3d,Python package/runtime in tools/voxcpm,3.12.11,2.8.0+cu128,12.8,596.36,13.2,h4n_ref20s_neutral_091_094,"mode=ultimate; cfg_value=2.0; inference_timesteps=10; prompt_text supplied","No speaker fine-tuning. Strong content retention and acoustic-series similarity, with some prosody artifacts."
